{
  "schemaVersion": "1.0.0",
  "kind": "capture-manifest",
  "pageId": "specimen",
  "stateId": "default",
  "side": "target",
  "platform": "web",
  "capturedAt": "2026-10-28T14:32:05.173Z",
  "source": {
    "url": "file:///D:/OurTrail/prototype-fidelity-suite/examples/generic-web/target/index.html",
    "projectRoot": null,
    "route": null,
    "codeVersion": "4922e151581e9ffbf8ee338cebe3fd47444c19a2",
    "dataSource": "real",
    "injection": null,
    "note": null
  },
  "viewport": {
    "width": 390,
    "height": 844
  },
  "dpr": 1,
  "screenshot": {
    "path": "screenshot.png",
    "sha256": "7d2c8e4b0397cf97cf7422bd5cdde08cae67a73d50709ba44626154bb5c33f78",
    "width": 390,
    "height": 844,
    "scale": {
      "x": 1,
      "y": 1
    },
    "normalizedFrom": "device-pixels"
  },
  "snapshot": {
    "nodes": 42,
    "rootId": "n0",
    "dimensions": {
      "width": 390,
      "height": 844
    }
  },
  "provenance": {
    "capturedBy": "prototype-fidelity-suite",
    "adapter": "web",
    "verification": "captured"
  }
}
