{
  "schemaVersion": "1.0.0",
  "kind": "capture-manifest",
  "pageId": "b-aa",
  "stateId": "default",
  "side": "target",
  "platform": "web",
  "capturedAt": "2026-10-28T14:32:22.762Z",
  "source": {
    "url": "file:///D:/OurTrail/prototype-fidelity-suite/examples/generic-web/b/aa.html",
    "projectRoot": null,
    "route": null,
    "codeVersion": "4922e151581e9ffbf8ee338cebe3fd47444c19a2",
    "dataSource": "real",
    "injection": null,
    "note": null
  },
  "viewport": {
    "width": 390,
    "height": 844
  },
  "dpr": 1,
  "screenshot": {
    "path": "screenshot.png",
    "sha256": "a74074a06355544e29e6a4aa908df605304ca501e8b567001e52726c03616de7",
    "width": 390,
    "height": 844,
    "scale": {
      "x": 1,
      "y": 1
    },
    "normalizedFrom": "device-pixels"
  },
  "snapshot": {
    "nodes": 10,
    "rootId": "n0",
    "dimensions": {
      "width": 390,
      "height": 844
    }
  },
  "provenance": {
    "capturedBy": "prototype-fidelity-suite",
    "adapter": "web",
    "verification": "captured"
  }
}
